{
  "name": "AYVA Optimized Layout",
  "base_anchors": [
    [
      -60,
      -40,
      0
    ],
    [
      60,
      -40,
      0
    ],
    [
      -60,
      0,
      0
    ],
    [
      60,
      0,
      0
    ],
    [
      -60,
      40,
      0
    ],
    [
      60,
      40,
      0
    ]
  ],
  "platform_anchors": [
    [
      -30,
      -40,
      0
    ],
    [
      30,
      -40,
      0
    ],
    [
      -30,
      0,
      0
    ],
    [
      30,
      0,
      0
    ],
    [
      -30,
      40,
      0
    ],
    [
      30,
      40,
      0
    ]
  ],
  "beta_angles": [
    0,
    0,
    0,
    0,
    0,
    0
  ],
  "horn_length": 46.7,
  "rod_length": 155.6
}