{
  "name": "Circular Layout (Symmetrical Default)",
  "base_anchors": [
    [
      70,
      0,
      0
    ],
    [
      35,
      60,
      0
    ],
    [
      -35,
      60,
      0
    ],
    [
      -70,
      0,
      0
    ],
    [
      -35,
      -60,
      0
    ],
    [
      35,
      -60,
      0
    ]
  ],
  "platform_anchors": [
    [
      50,
      0,
      0
    ],
    [
      25,
      43,
      0
    ],
    [
      -25,
      43,
      0
    ],
    [
      -50,
      0,
      0
    ],
    [
      -25,
      -43,
      0
    ],
    [
      25,
      -43,
      0
    ]
  ],
  "beta_angles": [
    0,
    1.047,
    2.094,
    3.142,
    -2.094,
    -1.047
  ],
  "horn_length": 50.0,
  "rod_length": 120.0,
  "servo_range": [
    -90,
    90
  ],
  "payload": {
    "mass_kg": 0.0,
    "stroke_mm": 0.0,
    "frequency_hz": 0.0
  }
}